{
    "contract_version": 1,
    "policy_id": "countyforge-implementation-commands",
    "version": 1,
    "default_network": "disabled",
    "commands": [
        {
            "id": "inspect.list-files",
            "executable": "find",
            "arguments": [
                "."
            ],
            "phase": "inspect",
            "network": "disabled",
            "workspace_mutating": false,
            "timeout_seconds": 60,
            "max_output_bytes": 65536,
            "environment": [
                "PATH",
                "PWD"
            ],
            "artifact_paths": []
        },
        {
            "id": "format.ruff",
            "executable": "uv",
            "arguments": [
                "run",
                "ruff",
                "format",
                "--check",
                "."
            ],
            "phase": "validate",
            "network": "disabled",
            "workspace_mutating": false,
            "timeout_seconds": 300,
            "max_output_bytes": 262144,
            "environment": [
                "PATH",
                "PWD",
                "UV_CACHE_DIR",
                "HOME"
            ],
            "artifact_paths": []
        },
        {
            "id": "lint.ruff",
            "executable": "uv",
            "arguments": [
                "run",
                "ruff",
                "check",
                "."
            ],
            "phase": "validate",
            "network": "disabled",
            "workspace_mutating": false,
            "timeout_seconds": 300,
            "max_output_bytes": 262144,
            "environment": [
                "PATH",
                "PWD",
                "UV_CACHE_DIR",
                "HOME"
            ],
            "artifact_paths": []
        },
        {
            "id": "typecheck.mypy",
            "executable": "uv",
            "arguments": [
                "run",
                "mypy"
            ],
            "phase": "validate",
            "network": "disabled",
            "workspace_mutating": false,
            "timeout_seconds": 600,
            "max_output_bytes": 262144,
            "environment": [
                "PATH",
                "PWD",
                "UV_CACHE_DIR",
                "HOME"
            ],
            "artifact_paths": []
        },
        {
            "id": "test.pytest",
            "executable": "uv",
            "arguments": [
                "run",
                "pytest"
            ],
            "phase": "validate",
            "network": "disabled",
            "workspace_mutating": false,
            "timeout_seconds": 1200,
            "max_output_bytes": 524288,
            "environment": [
                "PATH",
                "PWD",
                "UV_CACHE_DIR",
                "HOME"
            ],
            "artifact_paths": []
        },
        {
            "id": "spec.validate",
            "executable": "openspec",
            "arguments": [
                "validate",
                "--all",
                "--strict",
                "--no-interactive"
            ],
            "phase": "validate",
            "network": "disabled",
            "workspace_mutating": false,
            "timeout_seconds": 300,
            "max_output_bytes": 262144,
            "environment": [
                "PATH",
                "PWD"
            ],
            "artifact_paths": []
        },
        {
            "id": "docs.links",
            "executable": "uv",
            "arguments": [
                "run",
                "python",
                "scripts/check_doc_links.py"
            ],
            "phase": "validate",
            "network": "disabled",
            "workspace_mutating": false,
            "timeout_seconds": 300,
            "max_output_bytes": 262144,
            "environment": [
                "PATH",
                "PWD",
                "UV_CACHE_DIR",
                "HOME"
            ],
            "artifact_paths": []
        },
        {
            "id": "artifacts.check",
            "executable": "uv",
            "arguments": [
                "run",
                "python",
                "scripts/check_repository_artifacts.py"
            ],
            "phase": "validate",
            "network": "disabled",
            "workspace_mutating": false,
            "timeout_seconds": 300,
            "max_output_bytes": 262144,
            "environment": [
                "PATH",
                "PWD",
                "UV_CACHE_DIR",
                "HOME"
            ],
            "artifact_paths": []
        },
        {
            "id": "repo.check",
            "executable": "make",
            "arguments": [
                "check"
            ],
            "phase": "validate",
            "network": "disabled",
            "workspace_mutating": false,
            "timeout_seconds": 1800,
            "max_output_bytes": 524288,
            "environment": [
                "PATH",
                "PWD",
                "UV_CACHE_DIR",
                "HOME"
            ],
            "artifact_paths": []
        },
        {
            "id": "repo.runner-contract",
            "executable": "make",
            "arguments": [
                "runner-contract-tests"
            ],
            "phase": "validate",
            "network": "disabled",
            "workspace_mutating": false,
            "timeout_seconds": 1800,
            "max_output_bytes": 524288,
            "environment": [
                "PATH",
                "PWD",
                "UV_CACHE_DIR",
                "HOME"
            ],
            "artifact_paths": []
        },
        {
            "id": "repo.prepr-no-ai",
            "executable": "make",
            "arguments": [
                "prepr-no-ai"
            ],
            "phase": "validate",
            "network": "disabled",
            "workspace_mutating": false,
            "mutation_allowlist": [
                ".ai/reviews/review-packet.md",
                ".ai/reviews/review-packet.provenance.json"
            ],
            "timeout_seconds": 1800,
            "max_output_bytes": 524288,
            "environment": [
                "PATH",
                "PWD",
                "UV_CACHE_DIR",
                "HOME"
            ],
            "artifact_paths": []
        }
    ]
}
